{
  "placements": [
    {
      "copy_index": 0,
      "part_id": "line45-1",
      "sheet_id": "sheet-0",
      "transform": {
        "mirrored": false,
        "rotation_radians": 0.0,
        "translation": [
          3.360495483351066,
          18.400938356851306
        ]
      }
    },
    {
      "copy_index": 1,
      "part_id": "line45-1",
      "sheet_id": "sheet-0",
      "transform": {
        "mirrored": false,
        "rotation_radians": 0.0,
        "translation": [
          29.90413180537255,
          18.603206957315173
        ]
      }
    },
    {
      "copy_index": 2,
      "part_id": "line45-1",
      "sheet_id": "sheet-0",
      "transform": {
        "mirrored": false,
        "rotation_radians": 0.0,
        "translation": [
          3.344309722853019,
          35.21327623221752
        ]
      }
    },
    {
      "copy_index": 3,
      "part_id": "line45-1",
      "sheet_id": "sheet-0",
      "transform": {
        "mirrored": false,
        "rotation_radians": 3.141592653589793,
        "translation": [
          54.8040612961675,
          21.624486958643008
        ]
      }
    }
  ],
  "sheets": [
    {
      "id": "sheet-0",
      "stock_id": "stock"
    }
  ],
  "units": "mm",
  "version": 1
}
