{
  "version": 1,
  "units": "mm",
  "sheets": [
    {
      "id": "sheet-0",
      "stock_id": "stock"
    },
    {
      "id": "sheet-1",
      "stock_id": "stock"
    }
  ],
  "placements": [
    {
      "part_id": "frame",
      "sheet_id": "sheet-0",
      "copy_index": 0,
      "transform": {
        "rotation_radians": 1.5707963267948966,
        "translation": [
          356.525,
          6.525
        ],
        "mirrored": false
      }
    },
    {
      "part_id": "frame",
      "sheet_id": "sheet-0",
      "copy_index": 1,
      "transform": {
        "rotation_radians": 1.5707963267948966,
        "translation": [
          356.525,
          456.75
        ],
        "mirrored": false
      }
    },
    {
      "part_id": "frame",
      "sheet_id": "sheet-0",
      "copy_index": 2,
      "transform": {
        "rotation_radians": 1.5707963267948966,
        "translation": [
          356.525,
          906.975
        ],
        "mirrored": false
      }
    },
    {
      "part_id": "frame",
      "sheet_id": "sheet-0",
      "copy_index": 3,
      "transform": {
        "rotation_radians": 1.5707963267948966,
        "translation": [
          356.525,
          1357.2000000000003
        ],
        "mirrored": false
      }
    },
    {
      "part_id": "frame",
      "sheet_id": "sheet-0",
      "copy_index": 4,
      "transform": {
        "rotation_radians": 1.5707963267948966,
        "translation": [
          706.75,
          6.525
        ],
        "mirrored": false
      }
    },
    {
      "part_id": "frame",
      "sheet_id": "sheet-0",
      "copy_index": 5,
      "transform": {
        "rotation_radians": 1.5707963267948966,
        "translation": [
          706.75,
          456.75
        ],
        "mirrored": false
      }
    },
    {
      "part_id": "frame",
      "sheet_id": "sheet-0",
      "copy_index": 6,
      "transform": {
        "rotation_radians": 1.5707963267948966,
        "translation": [
          706.75,
          906.975
        ],
        "mirrored": false
      }
    },
    {
      "part_id": "frame",
      "sheet_id": "sheet-0",
      "copy_index": 7,
      "transform": {
        "rotation_radians": 1.5707963267948966,
        "translation": [
          706.75,
          1357.2000000000003
        ],
        "mirrored": false
      }
    },
    {
      "part_id": "frame",
      "sheet_id": "sheet-0",
      "copy_index": 8,
      "transform": {
        "rotation_radians": 1.5707963267948966,
        "translation": [
          1056.975,
          6.525
        ],
        "mirrored": false
      }
    },
    {
      "part_id": "frame",
      "sheet_id": "sheet-0",
      "copy_index": 9,
      "transform": {
        "rotation_radians": 1.5707963267948966,
        "translation": [
          1056.975,
          456.75
        ],
        "mirrored": false
      }
    },
    {
      "part_id": "frame",
      "sheet_id": "sheet-0",
      "copy_index": 10,
      "transform": {
        "rotation_radians": 1.5707963267948966,
        "translation": [
          1056.975,
          906.975
        ],
        "mirrored": false
      }
    },
    {
      "part_id": "frame",
      "sheet_id": "sheet-0",
      "copy_index": 11,
      "transform": {
        "rotation_radians": 1.5707963267948966,
        "translation": [
          1056.975,
          1357.2000000000003
        ],
        "mirrored": false
      }
    },
    {
      "part_id": "frame",
      "sheet_id": "sheet-0",
      "copy_index": 12,
      "transform": {
        "rotation_radians": 1.5707963267948966,
        "translation": [
          1056.975,
          1807.4250000000002
        ],
        "mirrored": false
      }
    },
    {
      "part_id": "frame",
      "sheet_id": "sheet-0",
      "copy_index": 13,
      "transform": {
        "rotation_radians": 1.5707963267948966,
        "translation": [
          1407.2000000000003,
          6.525
        ],
        "mirrored": false
      }
    },
    {
      "part_id": "frame",
      "sheet_id": "sheet-0",
      "copy_index": 14,
      "transform": {
        "rotation_radians": 1.5707963267948966,
        "translation": [
          1407.2000000000003,
          456.75
        ],
        "mirrored": false
      }
    },
    {
      "part_id": "frame",
      "sheet_id": "sheet-0",
      "copy_index": 15,
      "transform": {
        "rotation_radians": 1.5707963267948966,
        "translation": [
          1407.2000000000003,
          906.975
        ],
        "mirrored": false
      }
    },
    {
      "part_id": "frame",
      "sheet_id": "sheet-0",
      "copy_index": 16,
      "transform": {
        "rotation_radians": 1.5707963267948966,
        "translation": [
          1407.2000000000003,
          1357.2000000000003
        ],
        "mirrored": false
      }
    },
    {
      "part_id": "frame",
      "sheet_id": "sheet-0",
      "copy_index": 17,
      "transform": {
        "rotation_radians": 1.5707963267948966,
        "translation": [
          1407.2000000000003,
          1807.4250000000002
        ],
        "mirrored": false
      }
    },
    {
      "part_id": "cog",
      "sheet_id": "sheet-0",
      "copy_index": 0,
      "transform": {
        "rotation_radians": -2.2428996024478143,
        "translation": [
          124.16048637336014,
          2143.732006886875
        ],
        "mirrored": false
      }
    },
    {
      "part_id": "cog",
      "sheet_id": "sheet-0",
      "copy_index": 1,
      "transform": {
        "rotation_radians": -2.2428996024478143,
        "translation": [
          382.9547304688267,
          2143.732006886875
        ],
        "mirrored": false
      }
    },
    {
      "part_id": "cog",
      "sheet_id": "sheet-0",
      "copy_index": 2,
      "transform": {
        "rotation_radians": -2.2428996024478143,
        "translation": [
          124.16048637336014,
          2402.5262509823415
        ],
        "mirrored": false
      }
    },
    {
      "part_id": "cog",
      "sheet_id": "sheet-0",
      "copy_index": 3,
      "transform": {
        "rotation_radians": -2.2428996024478143,
        "translation": [
          382.9547304688267,
          2402.5262509823415
        ],
        "mirrored": false
      }
    },
    {
      "part_id": "cog",
      "sheet_id": "sheet-0",
      "copy_index": 4,
      "transform": {
        "rotation_radians": -2.2428996024478143,
        "translation": [
          124.16048637336014,
          2661.320495077808
        ],
        "mirrored": false
      }
    },
    {
      "part_id": "cog",
      "sheet_id": "sheet-0",
      "copy_index": 5,
      "transform": {
        "rotation_radians": -2.2428996024478143,
        "translation": [
          382.9547304688267,
          2661.320495077808
        ],
        "mirrored": false
      }
    },
    {
      "part_id": "cog",
      "sheet_id": "sheet-0",
      "copy_index": 6,
      "transform": {
        "rotation_radians": -2.2428996024478143,
        "translation": [
          124.16048637336014,
          2920.1147391732748
        ],
        "mirrored": false
      }
    },
    {
      "part_id": "cog",
      "sheet_id": "sheet-0",
      "copy_index": 7,
      "transform": {
        "rotation_radians": -2.2428996024478143,
        "translation": [
          382.9547304688267,
          2920.1147391732748
        ],
        "mirrored": false
      }
    },
    {
      "part_id": "cog",
      "sheet_id": "sheet-0",
      "copy_index": 8,
      "transform": {
        "rotation_radians": -2.2428996024478143,
        "translation": [
          824.6104863733601,
          2593.9570068868748
        ],
        "mirrored": false
      }
    },
    {
      "part_id": "cog",
      "sheet_id": "sheet-0",
      "copy_index": 9,
      "transform": {
        "rotation_radians": -2.2428996024478143,
        "translation": [
          1083.4047304688268,
          2593.9570068868748
        ],
        "mirrored": false
      }
    },
    {
      "part_id": "cog",
      "sheet_id": "sheet-0",
      "copy_index": 10,
      "transform": {
        "rotation_radians": -2.2428996024478143,
        "translation": [
          824.6104863733601,
          2852.751250982341
        ],
        "mirrored": false
      }
    },
    {
      "part_id": "cog",
      "sheet_id": "sheet-0",
      "copy_index": 11,
      "transform": {
        "rotation_radians": -2.2428996024478143,
        "translation": [
          1083.4047304688268,
          2852.751250982341
        ],
        "mirrored": false
      }
    },
    {
      "part_id": "cog",
      "sheet_id": "sheet-1",
      "copy_index": 12,
      "transform": {
        "rotation_radians": -2.2428996024478143,
        "translation": [
          124.16048637336014,
          342.8320068868745
        ],
        "mirrored": false
      }
    },
    {
      "part_id": "cog",
      "sheet_id": "sheet-1",
      "copy_index": 13,
      "transform": {
        "rotation_radians": -2.2428996024478143,
        "translation": [
          382.9547304688267,
          342.8320068868745
        ],
        "mirrored": false
      }
    },
    {
      "part_id": "cog",
      "sheet_id": "sheet-1",
      "copy_index": 14,
      "transform": {
        "rotation_radians": -2.2428996024478143,
        "translation": [
          641.7489745642933,
          342.8320068868745
        ],
        "mirrored": false
      }
    }
  ]
}
