{
  "version": 1,
  "units": "mm",
  "sheets": [
    {
      "id": "sheet-0",
      "stock_id": "sheet-type-1"
    }
  ],
  "placements": [
    {
      "part_id": "lead-group-unit-1",
      "copy_index": 0,
      "sheet_id": "sheet-0",
      "transform": {
        "translation": [
          3.3265390000000004,
          3.3265390000000004
        ],
        "rotation_radians": 0.0,
        "mirrored": false
      }
    },
    {
      "part_id": "lead-group-unit-1",
      "copy_index": 1,
      "sheet_id": "sheet-0",
      "transform": {
        "translation": [
          72.85807799999999,
          3.3265390000000004
        ],
        "rotation_radians": 0.0,
        "mirrored": false
      }
    }
  ]
}